[
  {
    "id": "id_mappfor_7626",
    "tipo": "ponte",
    "estagio": "EM EXECUÇÃO",
    "nome": "Ponte na Rua Manaus",
    "vulgo": "Ponte da Rua Manaus / Barra do Ceará",
    "lat": -3.7491601,
    "lng": -38.5887656,
    "extensaoNum": 40,
    "extensao": "A definir",
    "custoRaw": null,
    "custoTexto": "Dado não disponível",
    "construtora": "Prefeitura / SEINF",
    "inicio": "15/11/2023",
    "inauguracao": "Previsão: 12/2024",
    "bairro": "Barra do Ceará / SER XI",
    "metodo": "Ponte local em CA sobre canal no bairro Barra do Ceará. Vigas pré-moldadas e fundações em estacas.",
    "homenageado": "A Barra do Ceará é o Marco Zero histórico de Fortaleza (fundada 1604), onde o Rio Ceará encontra o Atlântico.",
    "fonte": "MAPP-FOR id_mappfor_7626 · SEINF",
    "eng": {
      "gabarito": "3,5 m (est.)",
      "fps": 1,
      "ciclo": "Não previsto",
      "drenTipo": "Gravidade (curso d'água)",
      "drenSis": "Livre",
      "drenSpec": "Seção do canal mantida. Gabarito hidráulico verificado para Q TR25.",
      "fundTipo": "Estacas Hélice Contínua",
      "fundProf": "~12 m",
      "fundObs": "Solo de várzea — areia fina saturada. Estacas em grupo de 2 por pilar. Enrocamento anti-erosão.",
      "isTunel": false
    }
  },
  {
    "id": "id_mappfor_3900",
    "tipo": "ponte",
    "estagio": "FINALIZADO",
    "nome": "Ponte José Martins Rodrigues",
    "vulgo": "Ponte da Barra / Ponte sobre o Rio Ceará",
    "lat": -3.6998743445272466,
    "lng": -38.58800160405429,
    "extensaoNum": 634,
    "extensao": "633,75 m (largura 20,2 m)",
    "custoRaw": 17000000,
    "custoTexto": "R$ 17 M (1997)",
    "construtora": "Prefeitura Fortaleza + Caucaia (CHC); reforma: SEINF",
    "inicio": "1995",
    "inauguracao": "11/10/1997 (iluminação RGB: 06/06/2024)",
    "bairro": "Barra do Ceará / SER XI",
    "metodo": "29 vãos de 21,8 m em vigas protendidas pré-moldadas. Pilares duplos. Pista dupla 20,2 m. Reforma 2024: 120 projetores RGB + ciclofaixa.",
    "homenageado": "José Martins Rodrigues (1929–1993), advogado, professor da UFC e defensor dos direitos humanos. Eleita o local mais representativo de Fortaleza em 2014 (70% dos votos).",
    "fonte": "MAPP-FOR id_mappfor_3900 · Diário do Nordeste (10/2022) · URB News (06/2024)",
    "eng": {
      "gabarito": "5,5 m (nav. fluvial)",
      "fps": 2,
      "ciclo": "Ciclofaixa (2024)",
      "drenTipo": "Gravidade (tabuleiro)",
      "drenSis": "Transversal",
      "drenSpec": "Bocas-de-lobo a cada 10 m lançando no Rio Ceará. Sarjetas aço galvanizado.",
      "fundTipo": "Tubulões a Céu Aberto",
      "fundProf": "~15 m",
      "fundObs": "Tubulões ø80 cm no leito do rio. Enrocamento granítico anti-erosão por pilar. Inspeção subaquática a cada 5 anos.",
      "isTunel": false
    }
  },
  {
    "id": "id_mappfor_5854",
    "tipo": "ponte",
    "estagio": "EM EXECUÇÃO",
    "nome": "Ponte dos Ingleses (Restauro)",
    "vulgo": "Ponte Metálica / Pier da Praia de Iracema",
    "lat": -3.7190168,
    "lng": -38.5145028,
    "extensaoNum": 130,
    "extensao": "130 m (projeto original: 800 m)",
    "custoRaw": 8000000,
    "custoTexto": "R$ 8 M (restauro 2020–2024)",
    "construtora": "Norton Griffts Co. (1920); restauro: SEINF",
    "inicio": "16/11/2020 (restauro)",
    "inauguracao": "25/08/2024 (reabertura)",
    "bairro": "Praia de Iracema / SER I",
    "metodo": "Estrutura histórica mista: pilares CA + superestrutura aço (Norton Griffts Co., 1920). Restauro 2020–2024: elétrica, postes, pilares madeira, vidro no guarda-corpo.",
    "homenageado": "Projetada em 1920 pela empresa inglesa Norton Griffts Co. Tombada em 1989. Tornou-se o cartão postal boêmio mais icônico de Fortaleza.",
    "fonte": "MAPP-FOR id_mappfor_5854 · Wikipedia · JP Turismo (08/2024) · iPatrimônio.org",
    "eng": {
      "gabarito": "3,0 m (pedonal)",
      "fps": 0,
      "ciclo": "Apenas pedestres",
      "drenTipo": "Gravidade (marinha)",
      "drenSis": "Livre para o mar",
      "drenSpec": "Agressividade ZA4 (NBR 6118). Pintura epóxi + poliuretano nos elementos metálicos. Inspeção anual.",
      "fundTipo": "Pilares CA Originais (1920)",
      "fundProf": "~5 m",
      "fundObs": "Pilares 1920 reforçados em 2020. Corrosão por cloretos tratada com ICM (Inibidor por Migração).",
      "isTunel": false
    }
  }
]