[
  {
    "id": "id_mappfor_2550",
    "tipo": "tunel",
    "estagio": "FINALIZADO",
    "nome": "Túnel Santos Dumont",
    "vulgo": "Túnel Santos Dumont / Via Expressa",
    "lat": -3.7396712921810384,
    "lng": -38.487653575393665,
    "extensaoNum": 170,
    "extensao": "~170 m",
    "custoRaw": null,
    "custoTexto": "Parte do corredor da Via Expressa",
    "construtora": "Prefeitura de Fortaleza / SEINF",
    "inicio": "11/05/2013",
    "inauguracao": "24/04/2014",
    "bairro": "Meireles / SER II",
    "metodo": "Estrutura celular de concreto armado em trincheira coberta (cut-and-cover). Elimina cruzamento da Av. Santos Dumont com a linha férrea e a Via Expressa. Fundações em estacas hélice contínua, drenagem profunda.",
    "homenageado": "Alberto Santos Dumont (1873–1932), Patrono da Força Aérea Brasileira. Realizou o voo 14-Bis em Paris em outubro de 1906. A Av. Santos Dumont conecta a Aldeota ao Aeroporto Internacional Pinto Martins.",
    "fonte": "MAPP-FOR id_mappfor_2550 · Seinfra-CE · SEINF",
    "eng": {
      "gabarito": "4,5 m",
      "fps": 2,
      "ciclo": "Ciclovia lateral",
      "drenTipo": "Gravidade + Bombeamento",
      "drenSis": "Misto",
      "drenSpec": "Calha perimetral + 2 poços de bombeamento (Q≈80 L/s), dreno longitudinal DN200.",
      "fundTipo": "Estacas Hélice Contínua",
      "fundProf": "~18 m",
      "fundObs": "Solo argiloso seco, SPT médio 12. Estacas ø50 cm. Contenção por paredes diafragma 40 cm.",
      "isTunel": true
    }
  },
  {
    "id": "id_mappfor_6",
    "tipo": "tunel",
    "estagio": "FINALIZADO",
    "nome": "Túnel Padre Antônio Tomás",
    "vulgo": "Túnel Via Expressa — Av. Pe. Antônio Tomás",
    "lat": -3.743459871063889,
    "lng": -38.489927114576346,
    "extensaoNum": 200,
    "extensao": "~200 m",
    "custoRaw": null,
    "custoTexto": "Parte do Corredor Norte-Sul da Via Expressa",
    "construtora": "Prefeitura de Fortaleza / SEINF",
    "inicio": "05/05/2015",
    "inauguracao": "31/12/2017",
    "bairro": "Cocó / SER II",
    "metodo": "Trincheira coberta de CA com paredes atirantadas. Corredor Norte-Sul da Via Expressa. Fundações em estacas hélice contínua, bombeamento e revestimento em placas cimentícias.",
    "homenageado": "Padre Antônio Tomás (séc. XIX–XX), sacerdote missionário cearense, fundador de obras sociais. A avenida conecta Cocó, Papicu e Joaquim Távora.",
    "fonte": "MAPP-FOR id_mappfor_6 · Seinfra-CE",
    "eng": {
      "gabarito": "4,5 m",
      "fps": 2,
      "ciclo": "Ciclofaixa bidirecional",
      "drenTipo": "Bombeamento",
      "drenSis": "Forçado",
      "drenSpec": "2 poços de recalque (Q≈100 L/s cada), calha DN300, sensor de nível automático.",
      "fundTipo": "Paredes Atirantadas + Estacas HC",
      "fundProf": "~20 m",
      "fundObs": "Lençol freático a ~3 m. Rebaixamento por wellpoints. Ancoragem atirantada em 3 níveis.",
      "isTunel": true
    }
  },
  {
    "id": "id_mappfor_2549",
    "tipo": "tunel",
    "estagio": "FINALIZADO",
    "nome": "Túnel Prof. Wagner Barreira",
    "vulgo": "3º Túnel da Via Expressa",
    "lat": -3.742209110613029,
    "lng": -38.488673577315524,
    "extensaoNum": 370,
    "extensao": "370 m (74 m cobertos)",
    "custoRaw": 20000000,
    "custoTexto": "Aprox. R$ 20 M",
    "construtora": "Prefeitura / SEINF (convênio Seinfra-CE)",
    "inicio": "26/05/2017",
    "inauguracao": "22/12/2018",
    "bairro": "Papicu / SER II",
    "metodo": "Túnel longitudinal em trincheira coberta — 370 m totais / 74 m cobertos. Permite passagem do VLT sem cruzamento com veículos. Pista em concreto, ciclovia, LED, revestimento em alumínio.",
    "homenageado": "Wagner Barreira (1913–c.1990), professor, jurista e advogado cearense. Catedrático de Direito na UFC (1938). Juiz do TRE-CE em 1961.",
    "fonte": "MAPP-FOR id_mappfor_2549 · Governo CE / Seinfra (22/12/2018)",
    "eng": {
      "gabarito": "4,8 m",
      "fps": 2,
      "ciclo": "Ciclovia",
      "drenTipo": "Gravidade + Bombeamento",
      "drenSis": "Misto",
      "drenSpec": "Calha perimetral + poço central. Bomba submersível Q≈60 L/s. Sensor LED de inundação.",
      "fundTipo": "Estacas Hélice Contínua",
      "fundProf": "~16 m",
      "fundObs": "Solo areno-argiloso, SPT 10–15. Estacas ø50 cm, espaç. 2,5 m. Laje suporta VLT (22 t/eixo).",
      "isTunel": true
    }
  },
  {
    "id": "id_mappfor_2548",
    "tipo": "tunel",
    "estagio": "FINALIZADO",
    "nome": "Túnel Alberto Sá",
    "vulgo": "4º Túnel da Via Expressa",
    "lat": -3.7325041775966263,
    "lng": -38.483012894832996,
    "extensaoNum": 180,
    "extensao": "~180 m",
    "custoRaw": null,
    "custoTexto": "Parte do Corredor Norte-Sul da Via Expressa",
    "construtora": "Prefeitura de Fortaleza / SEINF",
    "inicio": "26/05/2017",
    "inauguracao": "31/05/2020",
    "bairro": "Aldeota / SER II",
    "metodo": "4º túnel longitudinal do eixo da Via Expressa. Elimina o último cruzamento em nível do VLT. Pista em concreto, drenagem profunda, iluminação LED.",
    "homenageado": "Alberto Sá (1906–c.1984), político e servidor público cearense com atuação relevante na administração municipal do século XX.",
    "fonte": "MAPP-FOR id_mappfor_2548 · Seinfra-CE",
    "eng": {
      "gabarito": "4,5 m",
      "fps": 2,
      "ciclo": "Passeio lateral",
      "drenTipo": "Bombeamento",
      "drenSis": "Forçado",
      "drenSpec": "Poço de recalque + calha perimetral DN200. Automação por boia de nível.",
      "fundTipo": "Estacas Hélice Contínua",
      "fundProf": "~14 m",
      "fundObs": "Solo arenoso fino. Estacas ø40 cm. Contenção CA 30 cm. Impermeabilização PEAD exterior.",
      "isTunel": true
    }
  },
  {
    "id": "id_mappfor_2421",
    "tipo": "tunel",
    "estagio": "FINALIZADO",
    "nome": "Túnel Wellington Landim",
    "vulgo": "Santana Júnior × Pe. Antônio Tomás",
    "lat": -3.743978023043234,
    "lng": -38.487894845299536,
    "extensaoNum": 180,
    "extensao": "~180 m",
    "custoRaw": null,
    "custoTexto": "Parte do corredor Antônio Bezerra–Papicu",
    "construtora": "Prefeitura / SEINF — Corredor AB/Papicu",
    "inicio": "02/05/2016",
    "inauguracao": "31/08/2016",
    "bairro": "Papicu / SER II",
    "metodo": "Trincheira coberta de CA. Parte do BRT Antônio Bezerra–Papicu. Laje de cobertura reforçada para carga VLT (22 t/eixo).",
    "homenageado": "Wellington Landim (1953–2015), médico ultrassonografista e deputado estadual cearense. Presidiu a Alece por dois biênios. Faleceu de meningite bacteriana.",
    "fonte": "MAPP-FOR id_mappfor_2421 · SEINF · O Povo (03/2026)",
    "eng": {
      "gabarito": "4,5 m",
      "fps": 2,
      "ciclo": "Ciclovia bilateral",
      "drenTipo": "Gravidade",
      "drenSis": "Gravitário",
      "drenSpec": "Calha longitudinal com saída para galeria municipal. Grelhas e bocas-de-lobo pré-moldados.",
      "fundTipo": "Estacas HC + Laje Reforçada",
      "fundProf": "~16 m",
      "fundObs": "Laje com armação dupla para carga ferroviária VLT (NBR 7188). Estacas ø50 cm em grupo de 3.",
      "isTunel": true
    }
  },
  {
    "id": "wikimapia_DDummar",
    "tipo": "tunel",
    "estagio": "FINALIZADO",
    "nome": "Túnel Jornalista Demócrito Dummar",
    "vulgo": "Túnel do Castelão / Av. Alberto Craveiro",
    "lat": -3.8064,
    "lng": -38.5248,
    "extensaoNum": 440,
    "extensao": "440 m",
    "custoRaw": 38400000,
    "custoTexto": "R$ 38,4 M (Tesouro Estadual)",
    "construtora": "Governo do Estado do Ceará / SOP-CE",
    "inicio": "2012",
    "inauguracao": "07/06/2014",
    "bairro": "Boa Vista / Passaré — SER VI",
    "metodo": "Trincheira coberta (cut-and-cover) de CA. Duas pistas de 3 faixas, ciclovia bilateral, calçadas, drenagem gravitária, LED. Copa do Mundo FIFA 2014.",
    "homenageado": "Demócrito Rocha Dummar (1926–2008), fundador do Sistema Verdes Mares — maior grupo de comunicação do Nordeste (Diário do Nordeste, TV Verdes Mares).",
    "fonte": "Wikimapia · Governo CE (SOP) · O Povo (03/2026)",
    "eng": {
      "gabarito": "5,0 m",
      "fps": 3,
      "ciclo": "Ciclovia bilateral",
      "drenTipo": "Gravidade",
      "drenSis": "Gravitário",
      "drenSpec": "Rede coletora DN400 para galeria da Av. Paulino Rocha. Bocas-de-lobo duplas a cada 25 m.",
      "fundTipo": "Paredes Diafragma + Laje Subpressão",
      "fundProf": "~22 m",
      "fundObs": "Próximo ao Riacho Maceió. Lençol freático elevado — laje fundo dimensionada à subpressão. Paredes e=60 cm.",
      "isTunel": true
    }
  }
]